{
  "$schema": "https://json-schema.org/draft-07/schema",
  "type": "array",
  "items": {
    "type": "object",
    "additionalProperties": false,
    "properties": {
      "name": { "type": "string" },
      "techLevel": { "type": "number" },
      "traits": { "$ref": "shared/common.schema.json#/definitions/traits" },
      "description": {
        "type": "string"
      },
      "notes": {
        "type": "string"
      },
      "activationCost": { "$ref": "shared/common.schema.json#/definitions/activationCost" },
      "range": { "$ref": "shared/enums.schema.json#/definitions/range" },
      "damage": { "$ref": "shared/common.schema.json#/definitions/damage" },
      "actionType": { "$ref": "shared/enums.schema.json#/definitions/actionType" },
      "actions": {
        "type": "array",
        "items": { "$ref": "shared/objects.schema.json#/definitions/action" }
      }
    }
  }
}
